<?xml version="1.0" encoding="iso-8859-1" standalone="no"?>
<!DOCTYPE index SYSTEM "../dtd/index.dtd">
<index id="46451" pubid="352">
<title>Index</title>
<subtitle>M</subtitle>

<entry><head><key>Mace</key> <emph type="i">See</emph> Importation.</head></entry>
<entry><head><key>Marriages</key>, Births, Burials, Bachelors, and Widowers</head>
<table id="t1">
				<tr>
					<td cols="3"/>
				</tr>
				<tr>
				 <td/>
					<td>Statute</td>
					<td>Page</td>
				</tr>
				<tr>
					<td>For granting certain Duties upon, for the Term of Five Years, for carrying on the War with France with Vigour.<br/>
					<emph type="i">Duties continued until</emph> 1<emph type="i">st August</emph> 1706, 8 &amp; 9 <emph type="i">W.III.c</emph>. 20. &sect; 14. <emph type="i">and the Powers of this Act relating to the Duties to be executed</emph> 9 &amp; 10 <emph type="i">W.III.c</emph>. 35. &sect; 1. <emph type="i">but now expired</emph>.</td>
					<td>6 &amp; 7 <emph type="i">W</emph>. &amp; <emph type="i">M. c</emph>. 6. <emph type="i">exp</emph>.</td>
					<td>568</td>
				</tr>
				<tr>
					<td>Persons in Holy Orders to keep a Register of Marriages, Christenings, and Burials.<br/>
					<emph type="i">Indemnity to Persons, in certain Cases, for not having kept Register</emph>, 4 <emph type="i">Ann. c</emph>.12. &sect; 10.<br/>
					<emph type="i">As to preserving Registers, see</emph> 52 <emph type="i">G.III.c</emph>.146.</td>
					<td>&sect; 20.</td>
					<td>577</td>
				</tr>
			 <tr>
					<td>Parson, &amp;c. marrying Persons in Places pretending to be exempt from Visitation, without a License, unless Banns published&mdash;First Offence, Penalty &pound;100; Second Offence, Suspension for Three Years.<br/>
					<emph type="i">Extended to Places not exempt</emph>, &amp; <emph type="i">c</emph>. 7 &amp; 8 <emph type="i">W.III.c</emph>. 35. &sect; 2. <emph type="i">and see</emph> &sect; 5. 6. <emph type="i">of that Act</emph>.</td>
					<td>&sect; 47.</td>
					<td>581</td>
				</tr>
		 </table></entry>
			<entry><head><key>Master of the Crown Office</key> <emph type="i">See</emph> Court of King's Bench. Crown Office.</head></entry>
			<entry><head><key>Measuring of Ships</key> <emph type="i">See</emph> Connage of Ships.</head></entry>
			<entry><head><key>Metal made of English Dre only</key> <emph type="i">See</emph> Exportation.</head></entry>
			<entry><head><key>Militia and Crained Bands</key></head>
<table id="t2">
				<tr>
					<td cols="3"/>
				</tr>
				<tr>
				<td/>
				<td>Pages</td>
				</tr>
				<tr>
					<td>Statutes, 2 W. &amp; M. Sess. 2. c.12.</td>
					<td>246</td>
				</tr>
				<tr>
					<td>3 W. &amp; M.c.7.</td>
					<td>310</td>
				</tr>
				<tr>
					<td>4 W. &amp; M.c.6.</td>
					<td>387</td>
				</tr>
				<tr>
					<td>5 &amp; 6 W. &amp; M. c. 19.</td>
					<td>482</td>
				</tr>
				<tr>
					<td>6 &amp; 7 W. &amp; M. c. 13.<br/>
					<emph type="i">See</emph> Commission and Warrant Officers in their Majesties Service by Land.</td>
					<td>594</td>
				</tr>
			</table></entry>
			<entry><head><key>Mines</key></head>
<table id="t3">
				<tr>
					<td cols="3"/>
				</tr>
				<tr>
				 <td/>
					<td>Statute</td>
					<td>Page</td>
				</tr>
				<tr>
					<td>To prevent Disputes and Controversies concerning Royal Mines.</td>
					<td>5 <emph type="i">W</emph>. &amp; <emph type="i">M. c</emph>. 6.</td>
					<td>446</td>
				</tr>
				<tr>
					<td>Owners of Lead, &amp;c. Mines, to enjoy them, notwithstanding Claim of Royal Mine.</td>
					<td>&sect; 1.</td>
					<td>
						<emph type="i">Ib</emph>.</td>
				</tr>
				<tr>
					<td>King to have the Ore (Exception) at a Rate. Several Rates.<br/>
					<emph type="i">The Rate altered</emph>, 55 <emph type="i">G. III.c</emph>. 134.</td>
					<td>&sect; 2.</td>
					<td>
						<emph type="i">Ib</emph>.</td>
				</tr>
				<tr>
					<td>Proviso for Charters, &amp;c. to Tinners of Devon and Cornwall.<br/>
					<emph type="i">See</emph> Multiplying Gold and Silver.</td>
					<td>&sect; 3.</td>
					<td>447</td>
				</tr>
			</table></entry>
<entry><head><key>Molasses</key> <emph type="i">See</emph> Ercise.</head></entry>
<entry><head><key>Money</key> <emph type="i">See</emph> Coin.</head></entry>
<entry><head><key>Monmouth</key>, Duke of</head>
 <table id="t4">
 <tr>
 <td cols="3"/>
 </tr>
 <tr>
 <td/>
					<td>Statute</td>
					<td>Page</td>
 </tr> 	
 <tr>
 <td>Attainted of High Treason.</td><td>1 <emph type="i">Jac. II. c</emph>. 2.</td>
 <td>2</td>
 </tr>
 </table></entry>
<entry><head><key>Mortgages</key>.</head>
			<table id="t5">
				<tr>
					<td cols="3"/>
				</tr>
				<tr>
				 <td/>
					<td>Statute</td>
					<td>Page</td>
				</tr>
				<tr>
					<td>For preventing Frauds by clandestine Mortgages.</td>
					<td>4 <emph type="i">W</emph>. &amp; <emph type="i">M. c</emph>. 16.</td>
					<td>404</td>
				</tr>
				<tr>
					<td>Debtor upon Judgment, &amp;c. taking up Money of another upon Mortgage, without giving Notice of the Judgment to the Mortgagee, unless, upon Notice by the Mortgagee, he pay off the same within 6 months, shall lose his Equity of Redemption, and Mortgagee may hold the Land against such Mortgagor for such Estate as was granted to him, freed from Equity of Redemption.</td>
					<td>&sect; 1.</td>
					<td>
						<emph type="i">Ib</emph>.</td>
				</tr>
				<tr>
					<td>Persons having mortgaged and mortgaging again without giving Notice to the Second or other succeeding Mortgagee, to lose his Equity of Redemption, and such Mortgagee may in like manner hold the Land.</td>
					<td>&sect; 2.</td>
					<td>405</td>
				</tr>
				<tr>
					<td>Under-Mortgagees may redeem.</td>
					<td>&sect; 3.</td>
					<td>
						<emph type="i">Ib</emph>.</td>
				</tr>
				<tr>
					<td>Proviso for Dower.</td>
					<td>&sect; 4.</td>
					<td>
						<emph type="i">Ib</emph>.</td>
				</tr>
			</table></entry>
<entry><head><key>Multiplying Gold and Silber</key></head>
<table id="t6">
				<tr>
					<td cols="3"/>
				</tr>
				<tr>
 <td/>
 <td>Statute</td>
 <td>Page</td>
 </tr>
				<tr>
					<td>Statute 5 H. IV. c. 4. repealed.</td>
					<td>1 <emph type="i">W</emph>. &amp; <emph type="i">M. c</emph>.30. &sect; 1.</td>
					<td>95</td>
				</tr>
				<tr>
					<td>Condition of Repeal.</td>
					<td>&sect; 2.</td>
					<td>
						<emph type="i">Ib</emph>.</td>
				</tr>
				<tr>
					<td>Mines of Copper, Tin, Iron, or Lead not to be adjudged Royal Mines, though Gold or Silver extracted out of the same.<br/>
					<emph type="i">This Section explained</emph>, 5&amp; 6 <emph type="i">W</emph>. &amp; <emph type="i">M. c</emph>. 6.</td>
					<td>&sect; 3.</td>
					<td>
						<emph type="i">Ib</emph>.</td>
				</tr>
				</table></entry>
				<entry><head><key>Mum</key> <emph type="i">See</emph> Excise.</head></entry>
				<entry><head><key>Mundick Metal</key> <emph type="i">See</emph> Exportation.</head></entry>
				<entry><head><key>Mutiny and Desertion.</key></head>
				<table id="t7">
				<tr>
					<td cols="3"/>
				</tr>
				<tr>
				 <td/>
					<td>Statute</td>
					<td>Page</td>
				</tr>
				<tr>
					<td rows="4">For punishing Officers and Soldiers who shall mutiny or desert their Majesties Service.</td>
					<td>1<emph type="i">W</emph>. &amp; <emph type="i">M. c</emph>. 5.</td>
					<td>55</td>
				</tr>
				<tr>
					<td>
						<emph type="i">Sess</emph>.2. <emph type="i">c</emph>.4.</td>
					<td>146</td>
				</tr>
				<tr>
					<td>2 <emph type="i">W</emph>. &amp; <emph type="i">M. Sess</emph>.2. <emph type="i">c</emph>.6.</td>
					<td>227</td>
				</tr>
				<tr>
					<td>4 <emph type="i">W</emph>. &amp; <emph type="i">M.c</emph>. 13.</td>
					<td>393</td>
				</tr>
				<tr>
					<td rows="2">Statutes 4 W. &amp; M. c. 13.&mdash;5 &amp; 6 W. &amp; M.c. 15. continued until 10th April 1796.</td>
					<td>5 &amp; 6 <emph type="i">W</emph>.&amp; <emph type="i">M. c</emph>.15.</td>
					<td>479</td>
				</tr>
				<tr>
					<td>6 &amp; 7 <emph type="i">W</emph>. &amp; <emph type="i">M. c</emph>. 8. &sect; 1,2.</td>
					<td>587</td>
				</tr>
			</table></entry>
</index>


