<?xml version="1.0" encoding="iso-8859-1" standalone="no"?>
<!DOCTYPE index SYSTEM "../dtd/index.dtd">
<index id="47015" pubid="353" publish="true">
	<title>Index</title>
	<subtitle>K</subtitle>
<section id="s1"><head>K.</head>
	<entry>
		<head>
			<key>The King</key>
		</head>
		<table id="t1">
			<tr>
				<td cols="3"/>
			</tr>
			<tr>
				<td/>
				<th>Statute</th>
				<th>Page</th>
				</tr>
<tr>
<td>For empowering His Majesty to apprehend and detain such Persons as he shall find Cause to suspect are conspiring against His Royal Person or Government.</td>
				<td>7 &amp; 8 <emph type="i">W. III. c</emph>. 11.</td>
				<td>74</td>
				</tr>				
<tr><td>Persons in Prison 20th Feb. 1695, or after, on Suspicion of Treason, &amp;c. may be detained until 1st Sept. 1696; and no Judge to bail without Order from the Privy Council.</td>
				<td>&sect; 1.</td>
				<td><emph type="i">Ib</emph>.</td>
				</tr>				
<tr><td>Persons so committed to have the Benefit of Stat. 31 Car. II. c. 2., and of all other Laws for the Liberty of the Subject.</td>
				<td>&sect; 2.</td>
				<td><emph type="i">Ib</emph>.</td>
				</tr>
<tr><td>Proviso for Privileges of Parliament.</td>
				<td>&sect; 3.</td>
				<td><emph type="i">Ib</emph>.</td>
				</tr>				
<tr><td>Lieutenants of Counties, and their Deputies, may, by Warrant under Hand and Seal, employ Persons to search for and seize and detain Horses of &pound;5 Value and upwards belonging to suspected Persons&mdash;And Owner liable to Innkeeper for Keep of such Horses, at a Rate herein mentioned.</td>
				<td>&sect; 4.</td>
				<td><emph type="i">Ib</emph>.</td>
				</tr>
<tr><td>Hours at which such Search may be made.</td>
				<td><emph type="i">Ib</emph>.</td>
				<td>
					<emph type="i">Ib</emph>.</td></tr>
<tr><td>In case of Resistance Persons may enter by Force, and Horses may be used in case of Invasion, &amp;c.</td>
				<td>
					<emph type="i">Ib</emph>.</td>
				<td>
					<emph type="i">Ib</emph>.</td></tr>
<tr><td>Proviso as to Breeding Mares.</td>
				<td>&sect; 5.</td>
				<td>
					<emph type="i">Ib</emph>.</td></tr>
<tr><td>For the better Security of His Majesty's Royal Person and Government.</td>
				<td>7 &amp; 8 <emph type="i">W. III. c</emph>. 27.</td>
				<td>114</td>
				</tr>
<tr><td>Refusing to take the Oaths of Stat. 1 W. &amp; M. c. 8., or to appear to have the said Oaths tendered to them &mdash;Penalty.</td>
				<td>&sect; 1.</td>
				<td>
					<emph type="i">Ib</emph>.</td></tr>
<tr><td>Persons tendering Oaths to record the Names, &amp;c. of Persons refusing to take them, or not appearing to certify the same to Justices of Assize, &amp;c. who are to estreat, and certify into Court of Exchequer.</td>
				<td>
					<emph type="i">Ib</emph>.</td>
				<td>
					<emph type="i">Ib</emph>.</td></tr>
<tr><td>Publishing, &amp;c. that His Majesty is not rightful King, or that the late King James or the pretended Prince of Wales hath any Right to the Crown, &amp;c.&mdash; Premunire, Stat. 16 R. II. c. 5.</td>
				<td>&sect; 2.</td>
				<td>
					<emph type="i">Ib</emph>.</td></tr>
<tr><td>Recital of the Association. <br/><emph type="i">Form of Association altered, see</emph> 13 &amp; 14 <emph type="i">W. III. c</emph>. 6. &sect; 16. <emph type="i">Determined</emph>, 1 <emph type="i">Ann.stat</emph>. 1. c. 22. &sect; 3.</td>
				<td>&sect; 3.</td>
				<td>
					<emph type="i">Ib</emph>.</td>
					</tr>
<tr><td>Commissioners of Public Accounts, and other Persons holding Offices under the Crown, to appear as herein mentioned, and subscribe the said Association.</td>
				<td>&sect; 4.</td>
				<td>115</td>
				</tr>
<tr><td>Persons admitted, &amp;c. into any Office, Civil or Military, or receiving Pay, &amp;c. under Patent or Grant from the Crown, &amp;c. to subscribe the said Association at the same Time that they make and subscribe the Declaration of Stat. 25 Car.II. c.2.</td>
				<td>&sect; 5.</td>
				<td>
					<emph type="i">Ib</emph>.</td>
					</tr>
<tr><td>Persons neglecting, &amp;c. to subscribe the Association disabled.</td>
				<td>&sect; 6.</td>
				<td>
					<emph type="i">Ib</emph>.</td>
					</tr>
<tr><td>Persons who have neglected, &amp;c. to subscribe the said Association, and yet executing Offices&mdash;Penalty.</td>
				<td>&sect; 7.</td>
				<td>
					<emph type="i">Ib</emph>.</td>
			</tr>
				<tr>
				<td>Courts of Justice herein mentioned may tender the said Association for Subscription&mdash;Register of Subscription kept.</td>
				<td>7 &amp; 8 <emph type="i">W. III. c</emph>. 27. &sect; 8.</td>
				<td>115</td>
			</tr>
			<tr>
				<td>In what Case Persons who have forfeited Offices, by neglecting, &amp;c. to subscribe, may hold the same again.</td>
				<td>&sect; 9.</td>
				<td>
					<emph type="i">Ib</emph>.</td>
			</tr>
			<tr>
				<td>Limitation of Information for Words spoken &mdash; Two Witnesses necessary to Conviction. <br/><emph type="i">As to Repeal of Sections from 3 to 10, both inclusive, see 1 Ann. stat</emph>. 1. <emph type="i">c</emph>. 22. &sect; 3.</td>
				<td>&sect; 10.</td>
				<td>116.</td>
			</tr>
				<tr>
				<td>Proviso for Quakers making and subscribing Declaration of Fidelity of Stat. 1 W. &amp; M. c. 18., and proving themselves to be Quakers.</td>
				<td>&sect; 11.</td>
				<td>
					<emph type="i">Ib</emph>.</td>
			</tr>
			<tr>
				<td>Persons in the Service of Prince and Princess of Denmark to subscribe the said Association&mdash;Penalty.</td>
				<td>&sect; 12.</td>
				<td>
					<emph type="i">Ib</emph>.</td>
			</tr>
			<tr>
				<td>Proviso for Persons in His Majesty's Service in the Fleet or beyond Sea.</td>
				<td>&sect; 13.</td>
				<td>
					<emph type="i">Ib</emph>.</td>
			</tr>
			<tr>
				<td>Proviso for Pardon of Penalties, &amp;c. under the Privy Seal.</td>
				<td>&sect; 14.</td>
				<td>
					<emph type="i">Ib</emph>.</td>
			</tr>
			<tr>
				<td>After the Determination of the present Parliament, Members taking the Oaths, &amp;c. of Stat. 1 W. &amp; M. c. 8. to subscribe the said Association.</td>
				<td>&sect; 15.</td>
				<td>
					<emph type="i">Ib</emph>.</td>
			</tr>
			<tr>
				<td>Refusing, disabled to sit &mdash;New Writ.</td>
				<td>
					<emph type="i">Ib</emph>.</td>
				<td>
					<emph type="i">Ib</emph>.</td>
			</tr>
			<tr>
				<td>English Subjects returning from France without Leave under Sign Manual&mdash;High Treason.</td>
				<td>&sect; 16.</td>
				<td>
					<emph type="i">Ib</emph>.</td>
			</tr>
			<tr>
				<td>English Subjects returned from France since 29th Sept. 1695, without Licence under Stat. 3 W. &amp; M. c. 13. to surrender themselves and take the Oaths of Stat. 1 W. &amp; M. c. 8., and give Security for good Behaviour; or otherwise, not having Licence to continue, to depart the Kingdom, and not return during the War with France without Licence.</td>
				<td>&sect; 17.</td>
				<td>117</td>
			</tr>
			<tr>
				<td>Refusing to surrender, &amp;c. or returning&mdash; Premunire.</td>
				<td>
					<emph type="i">Ib</emph>.</td>
				<td>
					<emph type="i">Ib</emph>.</td>
			</tr>
			<tr>
				<td>Persons refusing the Oaths of Stat. 1 W. &amp; M. c. 8., or, being Quakers, refusing to subscribe the Declaration of Fidelity of Stat. 1 W. &amp; M. c. 18, which may be administered by Sheriff, &amp;c. at Poll, not admitted to vote.</td>
				<td>&sect; 18.</td>
				<td>
					<emph type="i">Ib</emph>.</td>
			</tr>
			<tr>
				<td>Persons committed for High Treason before the last Day of Trinity Term 1696, may be detained without Bail until 1st Dec. 1696, unless bailed by Order of Council.</td>
				<td>&sect; 19.</td>
				<td>
					<emph type="i">Ib</emph>.</td>
			</tr>
			<tr>
				<td>No Commission, Civil or Military, to cease by the Demise of the King, save as herein mentioned. <br/><emph type="i">This Clause explained</emph>, 1 <emph type="i">Ann. stat</emph>. 1. <emph type="i">c</emph>. 8. &sect; 1, 2.</td>
				<td>&sect; 20.</td>
				<td>
					<emph type="i">Ib</emph>.</td>
			</tr>
				<tr>
				<td>This Act concerning the Subscription of the Association, not to make void Offices of Inheritance in Fee-Simple, so as the Persons holding such Offices appoint Deputies until such Time as the Persons having such Offices subscribe the Association, and so as such Deputies subscribe the same and be approved by the King.<br/>
				<emph type="i">See Note to</emph> &sect; 10.</td>
				<td>7 &amp; 8 <emph type="i">W.III.c</emph>. 27. &sect; 21.</td>
				<td>117</td>
			</tr>
			<tr>
				<td>For continuing the Imprisonment of Counter, and others, for the late horrid Conspiracy to assassinate the Person of His Sacred Majesty.</td>
				<td>9 <emph type="i">W.III.c</emph>.4.</td>
				<td>300</td>
			</tr>
			<tr>
				<td>Imprisonment continued until 1st Jan. 1698, &amp;c. unless bailed, &amp;c. by Order of Council.</td>
				<td>
					<emph type="i">Exp</emph>.</td>
			</tr>
			<tr>
				<td>For continuing the Imprisonment of Counter, and others, for the late Conspiracy to assassinate the Person of His Sacred Majesty.<br/><emph type="i">See</emph> Cunnage and Boundage.</td>
				<td>10 <emph type="i">W.III.c</emph>.19. <emph type="i">exp</emph>.</td>
				<td>531</td>
			</tr>
		</table>
	</entry>
	<entry>
		<head>
			<key>King's Bench Prison</key>
			<emph type="i"> See</emph> Creditors.</head>
	</entry>
</section>
</index>


